{
  "documentId": "waffle",
  "documentType": "Agent",
  "schemaRef": "AgentSchema/v1",
  "agentKind": "orchestrator",
  "status": "ACTIVE",
  "tags": [
    "scope:waffle"
  ],
  "createdAt": "2026-07-08T00:00:00Z",
  "updatedAt": "2026-07-08T00:00:00Z",
  "content": {
    "title": {
      "blockType": "Title",
      "title": "waffle"
    },
    "scope": {
      "blockType": "Scope",
      "title": "管轄範囲",
      "path": "waffle/",
      "description": "スキーマという型で文書を焼き上げる、構造検証＋意味ガイダンス内蔵のドキュメントエンジン「Waffle」。JSON Schemaでdocument.jsonを検証・query・render・scaffoldする。自己完結ディレクトリ（`git subtree split --prefix=waffle`で独立可能）。"
    },
    "operatingRules": {
      "blockType": "OperatingRules",
      "title": "運用ルール",
      "items": [
        {
          "rule": "document.json操作は必ずCLI/MCP経由で行う",
          "why": "自分自身がdogfood対象のため",
          "howToApply": "create/fill/validate/render/query/check-*/scan-source-code/lint-docstringを使う（直接読み書きしない）"
        },
        {
          "rule": "既存document.jsonはscaffold fillで編集する",
          "why": "x-prompt-write宣言済みpathへ書き込めるため",
          "howToApply": "配列は query で現在値取得→組み立て→fill で丸ごと置き換え"
        },
        {
          "rule": "schemaに新規必須トップレベルキー追加時のみEdit/Writeを許容する",
          "why": "fill/createは新規キーの後追いマージをしないため",
          "howToApply": "check-schema-version-drift で検知されたキーのみEdit/Writeで追記"
        },
        {
          "rule": "document.jsonのパスは`.waffle/`を使う",
          "why": "has-udd汎用パス（`.has-udd/`）と混在させないため",
          "howToApply": "`waffle/.waffle/documents/`配下に置く"
        },
        {
          "rule": "repo rootからは`uv run --project waffle waffle <command>`で呼ぶ",
          "why": "waffleはrepo rootとは別プロジェクトのため",
          "howToApply": "deploy先パスは`waffle/`配下を明示する"
        },
        {
          "rule": "Skill/advisor間はテキストベース疎結合を保つ",
          "why": "受け手の内部形式を事前に知らなくてよくするため（腐敗防止層と同型）",
          "howToApply": "入出力はテキストに統一し、構造化への成型は受け手側が行う"
        }
      ]
    },
    "keyCommands": {
      "blockType": "KeyCommands",
      "title": "主要コマンド",
      "items": [
        {
          "command": "uv run pytest",
          "purpose": "unit/integration/acceptance/contractの4層テストを実行する"
        },
        {
          "command": "uv run waffle validate --path <document.jsonのパス>",
          "purpose": "document.jsonをschemaに適合検証する"
        },
        {
          "command": "uv run waffle render --path <document.jsonのパス>",
          "purpose": "document.jsonを成果物（SKILL.md等）へ描画し、deploy先（.claude/skills/等）へ配置する"
        },
        {
          "command": "uv run waffle query --operation <操作名> --path <document.jsonのパス>",
          "purpose": "document.jsonの内容を確認・検索する（get_block/get_field等16操作）"
        },
        {
          "command": "uv run waffle scaffold --operation create|fill ...",
          "purpose": "document.jsonの骨格生成、および既存documentへの値の書き込みを行う"
        },
        {
          "command": "uv run waffle check-spec-integrity / check-scenario-drift / check-schema-version-drift",
          "purpose": "spec参照整合性・シナリオドリフト・schema版ドリフトを確認する"
        }
      ]
    },
    "subOrchestratorRefs": {
      "blockType": "SubOrchestratorRefs",
      "title": "委譲先",
      "items": []
    }
  }
}
